{
  "admins": [],
  "level_check": false,
  "min_level": 10,
  "name_check": false,
  "name_keywords": [],
  "name_patterns": [],
  "player_limit_check": false,
  "max_players": 20,
  "player_limit_exempt": [],
  "spam_check": true,
  "spam_window_seconds": 10,
  "spam_max_messages": 6,
  "spam_repeat_limit": 3,
  "spam_warnings": 1,
  "spam_forgive_minutes": 10,
  "spam_punish_commands": [],
  "kick_delay_seconds": 3,
  "level_message": "需要达到 {level} 级才能进入本服务器，升级后再来吧。",
  "name_message": "你的名字含有本服务器不允许的内容，请改名后再来。",
  "full_message": "服务器人数已满（上限 {max} 人），请稍后再来。",
  "spam_warning_message": "请不要刷屏，再犯会被处罚。",
  "spam_punish_message": "你因刷屏被请出服务器。",
  "record_limit": 100
}
